{
  "v": 1,
  "devices": [
    {
      "id": "device",
      "name": "服务器"
    }
  ],
  "accounts": [
    {
      "id": "11111111-1111-5111-8111-111111111111",
      "device_id": "device",
      "name": "普通连接",
      "username": "Agent 运行账号",
      "method": "default",
      "revision": 0,
      "is_default": true
    }
  ],
  "rules": [
    {
      "id": "22222222-2222-4222-8222-222222222222",
      "device_id": "device",
      "account_id": "11111111-1111-5111-8111-111111111111",
      "subject_type": "group",
      "subject_id": "ops",
      "subject_name": "运维组",
      "legacy_scope": false,
      "revision": 1
    }
  ]
}
